{
  "$schema": "https://json-schema.org/draft/2020-12/schema",
  "$id": "https://nexcanvas.dev/schemas/host-adapter.schema.json",
  "title": "NexCanvas Host Adapter",
  "type": "object",
  "required": ["schemaVersion", "id", "displayName", "sharedSkill", "discoveryPaths", "execution", "evidence", "limitations"],
  "properties": {
    "schemaVersion": {"const": "1.0"},
    "id": {"type": "string", "pattern": "^[a-z0-9][a-z0-9-]+$"},
    "displayName": {"type": "string", "minLength": 1},
    "sharedSkill": {"const": "SKILL.md"},
    "docsUrl": {"type": "string"},
    "discoveryPaths": {"type": "array", "items": {"type": "string"}},
    "executableNames": {"type": "array", "items": {"type": "string"}},
    "execution": {"enum": ["automated-cli", "manual-export"]},
    "evidence": {"type": "array", "minItems": 1, "items": {"type": "string"}},
    "limitations": {"type": "array", "items": {"type": "string"}}
  },
  "additionalProperties": false
}
